{
  "id": "focus.focus-ai-bridge-smoke-test",
  "kind": "tool-action",
  "displayName": "Focus AI Bridge Smoke Test",
  "description": "Read-only Focus integration smoke request that confirms the Spectra AI gateway is reachable.",
  "ownerRepo": "prism-spectra",
  "status": "enabled",
  "executionMode": "read-only",
  "entrypoint": {
    "type": "ai-request",
    "sourceApp": "prism-focus",
    "intent": "focus-ai-bridge-smoke-test"
  },
  "locality": "local",
  "dataBoundary": "local",
  "riskClass": "read-only",
  "approvalRequired": false,
  "allowedInputs": [
    "sourceApp",
    "intent",
    "riskClass",
    "preferredMode",
    "nodeType",
    "record",
    "input.prompt",
    "context.appSurface",
    "context.purpose"
  ],
  "allowedOutputs": [
    "response",
    "provenance"
  ],
  "allowedPaths": [],
  "allowedEnvVars": [],
  "networkPolicy": {
    "mode": "loopback-only",
    "allowedHosts": [
      "127.0.0.1"
    ]
  },
  "credentialPolicy": {
    "mode": "none",
    "envVars": []
  },
  "costPolicy": {
    "mode": "none"
  },
  "resourcePolicy": {
    "profile": "tiny"
  },
  "provenanceFields": [
    "routedBy",
    "sourceApp",
    "riskClass",
    "preferredMode",
    "graphId",
    "nodeId",
    "chainTried",
    "capabilityManifest"
  ],
  "telemetryFields": [
    "capabilityManifest.status",
    "capabilityManifest.id"
  ],
  "validation": {
    "tests": [
      "test:focus-ai",
      "test:ai-request",
      "capabilities:check"
    ]
  },
  "rollback": "Revert the manifest entry; Focus smoke tests fall back to current unmanifested observe-only behavior.",
  "failureMode": "If invalid, the loader omits this entry and the gateway records capabilityManifest.status=absent for this intent.",
  "disabledByDefault": false,
  "verifiedOn": "2026-07-08",
  "action": {
    "name": "focus-ai-bridge-smoke-test",
    "apiShape": "POST /api/v1/ai/request with sourceApp=prism-focus and intent=focus-ai-bridge-smoke-test",
    "modelMayInfluenceParameters": false,
    "terminalExecution": false,
    "fileWritesPossible": false,
    "allowedPathRoots": [],
    "approvalQueueIntegration": "none",
    "checkpointRequired": false,
    "validationRequired": false
  }
}
