{
  "id": "career.refine_epk_promo_copy",
  "kind": "tool-action",
  "displayName": "EPK Promo Kit Copy Refinement",
  "description": "Read-only EPK helper that returns a visible draft refinement of generated Promo Kit Markdown without mutating source copy.",
  "ownerRepo": "prism-spectra",
  "status": "enabled",
  "executionMode": "read-only",
  "entrypoint": {
    "type": "ai-request",
    "sourceApp": "EPK",
    "intent": "career.refine_epk_promo_copy"
  },
  "locality": "local",
  "dataBoundary": "local",
  "riskClass": "read-only",
  "approvalRequired": false,
  "allowedInputs": [
    "sourceApp",
    "intent",
    "riskClass",
    "preferredMode",
    "input.text",
    "input.instruction",
    "context.appSurface",
    "context.field"
  ],
  "allowedOutputs": [
    "response",
    "structuredResponse",
    "provenance"
  ],
  "allowedPaths": [],
  "allowedEnvVars": [],
  "networkPolicy": {
    "mode": "loopback-only",
    "allowedHosts": [
      "127.0.0.1"
    ]
  },
  "credentialPolicy": {
    "mode": "none",
    "envVars": []
  },
  "costPolicy": {
    "mode": "none"
  },
  "resourcePolicy": {
    "profile": "small"
  },
  "provenanceFields": [
    "routedBy",
    "sourceApp",
    "riskClass",
    "preferredMode",
    "graphId",
    "nodeId",
    "chainTried",
    "capabilityManifest"
  ],
  "telemetryFields": [
    "capabilityManifest.status",
    "capabilityManifest.id"
  ],
  "validation": {
    "tests": [
      "test:ai-request",
      "capabilities:check"
    ]
  },
  "rollback": "Revert the manifest entry; no EPK state migration is involved.",
  "failureMode": "If invalid, the loader omits this entry and the gateway records capabilityManifest.status=absent for this intent.",
  "disabledByDefault": false,
  "verifiedOn": "2026-07-08",
  "action": {
    "name": "career.refine_epk_promo_copy",
    "apiShape": "POST /api/v1/ai/request with sourceApp=EPK and intent=career.refine_epk_promo_copy",
    "modelMayInfluenceParameters": false,
    "terminalExecution": false,
    "fileWritesPossible": false,
    "allowedPathRoots": [],
    "approvalQueueIntegration": "none",
    "checkpointRequired": false,
    "validationRequired": false
  }
}
